timestamp,experiment_id,measurement_type,measurement_value,measurement_uncertainty,epoch,batch_id,validation_metric,quality_score,temperature_c,humidity_percent,equipment_id,researcher_notes
2024-06-15T08:00:00Z,EXP038,historical_a_analysis,0.7456,0.0089,1,3,0.7456,0.97,23.0,45.3,SPEC038,"Historical treatment A retrospective baseline"
2024-06-15T16:00:00Z,EXP038,historical_a_analysis,0.7523,0.0084,2,3,0.7523,0.98,22.8,45.0,SPEC038,"Historical A showing consistent performance"
2024-06-16T08:00:00Z,EXP038,historical_a_analysis,0.7578,0.0081,3,3,0.7578,0.99,22.6,44.7,SPEC038,"Historical treatment A retrospective complete"
2024-06-16T08:00:00Z,EXP039,historical_b_analysis,0.7089,0.0098,1,3,0.7089,0.96,22.4,44.4,SPEC039,"Historical treatment B retrospective baseline"
2024-06-16T16:00:00Z,EXP039,historical_b_analysis,0.7156,0.0093,2,3,0.7156,0.97,22.2,44.1,SPEC039,"Historical B showing expected pattern"
2024-06-17T08:00:00Z,EXP039,historical_b_analysis,0.7201,0.0089,3,3,0.7201,0.98,22.0,43.8,SPEC039,"Historical treatment B analysis complete"
2024-06-25T08:00:00Z,EXP040,meta_analysis,0.7312,0.0067,1,3,0.7312,0.99,21.8,43.5,SPEC040,"Meta-analysis of all historical data baseline"
2024-06-25T16:00:00Z,EXP040,meta_analysis,0.7356,0.0064,2,3,0.7356,0.99,21.6,43.2,SPEC040,"Comprehensive meta-analysis progression"
2024-06-26T08:00:00Z,EXP040,meta_analysis,0.7389,0.0062,3,3,0.7389,1.00,21.4,42.9,SPEC040,"Final meta-analysis ready for publication"